id,reviewServiceType,reviewType,reviewContent,createDate,channelServiceType,reviewScore,productName,productOptionContent
3137078062,SELLBLOG,NORMAL,밤비와 푸를 구매후 밤비를 시간날때마다 하고있는데 디테일이 있어서 완성후에도 이쁠거같습니다,2021-03-21T00:49:11.274+0000,STOREFARM,5,DIY 디즈니 캐릭터 보석십자수 액자형 프린세스 알라딘 밤비 앨리스 아이러브페인팅,제품 선택: 29. 귀여운 푸 보석십자수
3148812601,SELLBLOG,AFTER_USE,ㅋㅋㅋ 재미있어요 ㅎㅎㅎ,2021-04-07T00:22:33.119+0000,STOREFARM,5,DIY 디즈니 캐릭터 보석십자수 액자형 프린세스 알라딘 밤비 앨리스 아이러브페인팅,제품 선택: 22. 디즈니 캐슬 보석십자수
3128007058,SELLBLOG,AFTER_USE,구슬도 넉넉하고 잘 붙어서 좋아요,2021-03-08T11:26:47.664+0000,STOREFARM,5,DIY 디즈니 캐릭터 보석십자수 액자형 프린세스 알라딘 밤비 앨리스 아이러브페인팅,제품 선택: 18. 알라딘 커플 보석십자수
3115398293,SELLBLOG,NORMAL,판이 물렁할 줄 알았는데 그냥 나무판으로 딴딴해서 놀랐습니당! 비즈들도 그냥 비닐에  있는게 아니라 보관하기 쉽게 지퍼백에 담겨와서 더 좋았어요ㅎㅎ,2021-02-18T14:52:02.733+0000,STOREFARM,5,DIY 디즈니 캐릭터 보석십자수 액자형 프린세스 알라딘 밤비 앨리스 아이러브페인팅,제품 선택: 09.토이스토리4 투게더 보석십자수
3144185602,SELLBLOG,AFTER_USE,아이가 열심히 하고있어요^^,2021-03-31T06:36:33.771+0000,STOREFARM,4,DIY 디즈니 캐릭터 보석십자수 액자형 프린세스 알라딘 밤비 앨리스 아이러브페인팅,제품 선택: 17. 달밤 자스민 알라딘 보석십자수
3115680094,SELLBLOG,NORMAL,"설날 전에 배송된다는 문구보고 주문한건데
설 지나고 왔어요🥲
설연휴에 하고싶었는데 그 외에는
포장도 꼼꼼하고 망가짐없이 잘 왔습니다",2021-02-19T03:01:51.957+0000,STOREFARM,4,DIY 디즈니 캐릭터 보석십자수 액자형 프린세스 알라딘 밤비 앨리스 아이러브페인팅,제품 선택: 36. 푸우와 친구들 보석십자수
3143243106,SELLBLOG,NORMAL,"하고있는데 너무 커서 죽겠어요,,",2021-03-30T01:57:50.412+0000,STOREFARM,5,DIY 디즈니 캐릭터 보석십자수 액자형 프린세스 알라딘 밤비 앨리스 아이러브페인팅,제품 선택: 09.토이스토리4 투게더 보석십자수
3121107212,SELLBLOG,NORMAL,"밤비 먼저하고 앨리스 하려고요
친구도 사줄거에여 너무 이뻐용",2021-02-26T05:21:19.120+0000,STOREFARM,5,DIY 디즈니 캐릭터 보석십자수 액자형 프린세스 알라딘 밤비 앨리스 아이러브페인팅,제품 선택: 21. 숲속 앨리스 보석십자수
3140275749,SELLBLOG,NORMAL,완전 맘에 들어요 넘 예쁩니다~👍,2021-03-25T10:15:56.761+0000,STOREFARM,5,DIY 디즈니 캐릭터 보석십자수 액자형 프린세스 알라딘 밤비 앨리스 아이러브페인팅,제품 선택: 19. 자스민 알라딘 보석십자수
3118121185,SELLBLOG,NORMAL,시간 후딱 가고 재구매 할것 같아요 ㅎㅎ 캔버스라 더 좋아요,2021-02-22T07:51:50.453+0000,STOREFARM,5,DIY 디즈니 캐릭터 보석십자수 액자형 프린세스 알라딘 밤비 앨리스 아이러브페인팅,제품 선택: 19. 자스민 알라딘 보석십자수
3143030063,SELLBLOG,AFTER_USE,힘들긴 한데 그래도 재밌어요,2021-03-29T13:08:25.665+0000,STOREFARM,5,DIY 디즈니 캐릭터 보석십자수 액자형 프린세스 알라딘 밤비 앨리스 아이러브페인팅,제품 선택: 08.토이스토리4 노을 보석십자수
3114616197,SELLBLOG,NORMAL,아직 시작 전인데 도안만 봐도 설레요~완성된거 상상하면 너무 좋네요 조금씩 할꺼라 시간이 걸리겠지만 기분좋게 취미로 할수 있을것 같아요,2021-02-17T22:54:19.868+0000,STOREFARM,5,DIY 디즈니 캐릭터 보석십자수 액자형 프린세스 알라딘 밤비 앨리스 아이러브페인팅,제품 선택: 17. 달밤 자스민 알라딘 보석십자수
3118094838,SELLBLOG,NORMAL,배송은 말랐고 아직 해보지는 않았지만 지루한 주말을 함께 보내보려합니다,2021-02-22T07:07:57.383+0000,STOREFARM,4,DIY 디즈니 캐릭터 보석십자수 액자형 프린세스 알라딘 밤비 앨리스 아이러브페인팅,제품 선택: 25. 조각보 미키 보석십자수
3123221066,SELLBLOG,NORMAL,"다른 저렴이도 많은데 아이가 꼭 앨리스가 하고 싶다고 해서 설에 하려고 구입했어요~
작은 거 해보고 재미있다고 큰 거 액자형으로 사달라고 해서 말리다 구입했는데
3시간동안 4줄 완성했네요.
시간 오래 걸리지만 집중력은 좋아질 듯.
완성 다 하면 액자로 걸어놓으면 좋을 듯 해요!!",2021-03-01T16:38:25.213+0000,STOREFARM,5,DIY 디즈니 캐릭터 보석십자수 액자형 프린세스 알라딘 밤비 앨리스 아이러브페인팅,제품 선택: 21. 숲속 앨리스 보석십자수
3144959872,SELLBLOG,NORMAL,너무 이쁘네요 감사해요,2021-04-01T06:54:08.534+0000,STOREFARM,5,DIY 디즈니 캐릭터 보석십자수 액자형 프린세스 알라딘 밤비 앨리스 아이러브페인팅,제품 선택: 36. 푸우와 친구들 보석십자수
3122912612,SELLBLOG,NORMAL,저번에 한번 해보고 재밌어서 하나 더 구매 했습니다 얼른 완성하고 싶네요,2021-03-01T05:29:53.500+0000,STOREFARM,4,DIY 디즈니 캐릭터 보석십자수 액자형 프린세스 알라딘 밤비 앨리스 아이러브페인팅,제품 선택: 08.토이스토리4 노을 보석십자수
3126855895,SELLBLOG,NORMAL,정말 재밌어요 완성될때 뿌듯함 최고,2021-03-06T22:21:03.857+0000,STOREFARM,5,DIY 디즈니 캐릭터 보석십자수 액자형 프린세스 알라딘 밤비 앨리스 아이러브페인팅,제품 선택: 17. 달밤 자스민 알라딘 보석십자수
3109258033,SELLBLOG,NORMAL,만족만족 이거하면서  구해줘1 사이코지만 괜찮아 비밀의숲1 나의 아저씨정주행 했네요,2021-02-07T20:00:47.824+0000,STOREFARM,5,DIY 디즈니 캐릭터 보석십자수 액자형 프린세스 알라딘 밤비 앨리스 아이러브페인팅,제품 선택: 08.토이스토리4 노을 보석십자수
3126166729,SELLBLOG,NORMAL,우리 아이들이 좋아해서 샀는데 괜찮네요,2021-03-06T01:17:19.040+0000,STOREFARM,5,DIY 디즈니 캐릭터 보석십자수 액자형 프린세스 알라딘 밤비 앨리스 아이러브페인팅,제품 선택: 25. 조각보 미키 보석십자수
3143464651,SELLBLOG,AFTER_USE,아직도 완성 못했어요,2021-03-30T07:42:41.189+0000,STOREFARM,5,DIY 디즈니 캐릭터 보석십자수 액자형 프린세스 알라딘 밤비 앨리스 아이러브페인팅,제품 선택: 22. 디즈니 캐슬 보석십자수
3117746289,SELLBLOG,NORMAL,"생각보다 엄청커요!ㅎㅎ
디즈니충들은 꼭 사세여 넘나이쁩니다
인테리어 효과 톡톡 빨리 완성하구시퍼여",2021-02-21T23:39:17.439+0000,STOREFARM,5,DIY 디즈니 캐릭터 보석십자수 액자형 프린세스 알라딘 밤비 앨리스 아이러브페인팅,제품 선택: 14. 인어공주 커플 보석십자수
3127780876,SELLBLOG,AFTER_USE,틈틈이 해서 얼굴만 남았어요 재밌어요,2021-03-08T04:42:46.483+0000,STOREFARM,5,DIY 디즈니 캐릭터 보석십자수 액자형 프린세스 알라딘 밤비 앨리스 아이러브페인팅,제품 선택: 33. 푸우와 나비 보석십자수
3112302417,SELLBLOG,NORMAL,"시간가는줄 모르고했더니 한두시간이 지나있어요 
 너무 집중해서 했더니 하고나니 목이 아프네요 ㅋ 구성도 알차고 시간보내기 너무 좋아요!",2021-02-14T12:29:23.388+0000,STOREFARM,5,DIY 디즈니 캐릭터 보석십자수 액자형 프린세스 알라딘 밤비 앨리스 아이러브페인팅,제품 선택: 09.토이스토리4 투게더 보석십자수
3122182925,SELLBLOG,NORMAL,"보석십자수 작은건 해봤어도 큰건 처음인데
완성하고 나니 너무 이뻐서 또 사야겠네요.😍",2021-02-27T19:13:02.909+0000,STOREFARM,5,DIY 디즈니 캐릭터 보석십자수 액자형 프린세스 알라딘 밤비 앨리스 아이러브페인팅,제품 선택: 14. 인어공주 커플 보석십자수
3126458518,SELLBLOG,NORMAL,친구 생일선물로 줬는데 배송받고 나서 친구와 연락두절이 되었어요&bull;&bull;&bull; 알고봤더니 십자수하느라 정신없어서 밤샐 정도로 열심히 하고 있었대요 결과물이 궁금한데 아직도 하고있는지 연락이 잘 안되네요... 그치만 생일선물로 딱인거같아요,2021-03-06T07:11:42.888+0000,STOREFARM,5,DIY 디즈니 캐릭터 보석십자수 액자형 프린세스 알라딘 밤비 앨리스 아이러브페인팅,제품 선택: 09.토이스토리4 투게더 보석십자수
3141349071,SELLBLOG,NORMAL,딸아이가 입고될 때까지 기다렸다 샀어요.^^,2021-03-27T01:16:38.394+0000,STOREFARM,5,DIY 디즈니 캐릭터 보석십자수 액자형 프린세스 알라딘 밤비 앨리스 아이러브페인팅,제품 선택: 25. 조각보 미키 보석십자수
3123647687,SELLBLOG,AFTER_USE,디즈니성 완성하고 하려다가 다른거하느라 아직 손도못댄.... 꼭다완성할거에여ㅠㅠ,2021-03-02T11:42:55.138+0000,STOREFARM,5,DIY 디즈니 캐릭터 보석십자수 액자형 프린세스 알라딘 밤비 앨리스 아이러브페인팅,제품 선택: 16. 미녀와 야수 보석십자수
3123044127,SELLBLOG,NORMAL,너무 늦게 배송되서 ㅠ 근데 예쁘고 좋네요,2021-03-01T10:17:04.629+0000,STOREFARM,4,DIY 디즈니 캐릭터 보석십자수 액자형 프린세스 알라딘 밤비 앨리스 아이러브페인팅,제품 선택: 21. 숲속 앨리스 보석십자수
3124027426,SELLBLOG,NORMAL,둘이서 3일만에 완성했어요 너무 예뻐요!!,2021-03-03T06:46:53.882+0000,STOREFARM,5,DIY 디즈니 캐릭터 보석십자수 액자형 프린세스 알라딘 밤비 앨리스 아이러브페인팅,제품 선택: 21. 숲속 앨리스 보석십자수
3073045030,SELLBLOG,NORMAL,"집콕하고 있는데 심심해서 보석십자수 찾아보게 됐어요
여기 제품이 단단한 나무액자에 고정되어 와서 작업하기도 편하고 완성 후에 걸어놓기도 좋을 것 같아 사게 됐어요!
처음인데 너무 큰 걸 시작했나 싶었는데 아무래도 커야 그림이 예쁜 것 같아요
하는 것 자체는 어렵지 않은데 보석 크기가 작아서 오래 하면 눈이 아플 것 같아요
제품 두개 구매했는데 펜이랑 풀이랑 트레이를 서비스로 몇개 더 넣어주셨어요 감사합니다!
하는동안 별 생각없이 시간이 잘 갈 것 같아요~
끝내고 나면 다른 제품 또 구매하고 싶을 것 같아요",2020-12-22T04:42:58.625+0000,STOREFARM,5,DIY 디즈니 캐릭터 보석십자수 액자형 프린세스 알라딘 밤비 앨리스 아이러브페인팅,제품 선택: 21. 숲속 앨리스 보석십자수
3145265320,SELLBLOG,NORMAL,좋습니다좋습니다좋습니다,2021-04-01T13:51:59.687+0000,STOREFARM,5,DIY 디즈니 캐릭터 보석십자수 액자형 프린세스 알라딘 밤비 앨리스 아이러브페인팅,제품 선택: 13. 노을과 에리얼 보석십자수
3145264860,SELLBLOG,NORMAL,좋습니다좋습니다좋습니다,2021-04-01T13:51:24.120+0000,STOREFARM,5,DIY 디즈니 캐릭터 보석십자수 액자형 프린세스 알라딘 밤비 앨리스 아이러브페인팅,제품 선택: 29. 귀여운 푸 보석십자수
3123224412,SELLBLOG,NORMAL,보석십자수 실물이 훨씬 예뻐요! 근데 목이 좀 아파요 ㅋㅋㅋ,2021-03-01T16:58:23.750+0000,STOREFARM,5,DIY 디즈니 캐릭터 보석십자수 액자형 프린세스 알라딘 밤비 앨리스 아이러브페인팅,제품 선택: 13. 노을과 에리얼 보석십자수
3143286649,SELLBLOG,NORMAL,빠른 배송에 물건 좋네요ㅎㅎ,2021-03-30T03:05:39.227+0000,STOREFARM,5,DIY 디즈니 캐릭터 보석십자수 액자형 프린세스 알라딘 밤비 앨리스 아이러브페인팅,제품 선택: 28. 빌런 닥터 페실리어 보석십자수
3143286591,SELLBLOG,NORMAL,빠른 배송에 물건 좋네요ㅎㅎ,2021-03-30T03:05:32.851+0000,STOREFARM,5,DIY 디즈니 캐릭터 보석십자수 액자형 프린세스 알라딘 밤비 앨리스 아이러브페인팅,제품 선택: 17. 달밤 자스민 알라딘 보석십자수
3126520894,SELLBLOG,NORMAL,"아이가 받자마자 집중하여 합니다~
좋아합니다~~^^",2021-03-06T08:34:47.624+0000,STOREFARM,5,DIY 디즈니 캐릭터 보석십자수 액자형 프린세스 알라딘 밤비 앨리스 아이러브페인팅,제품 선택: 07.토이스토리4 더키버니 보석십자수
3119153455,SELLBLOG,AFTER_USE,"정말 너무 이뻐요^^
비즈도 생각했던것 보다 
훨씬 더 반짝거리고 선명해서 좋아요!!
완성도 최고! ♡♡♡",2021-02-23T14:19:59.731+0000,STOREFARM,5,DIY 디즈니 캐릭터 보석십자수 액자형 프린세스 알라딘 밤비 앨리스 아이러브페인팅,제품 선택: 14. 인어공주 커플 보석십자수
3137905922,SELLBLOG,NORMAL,"디자인 너무 귀여워요 ㅎㅎㅎ
잘사용하겟습니다~",2021-03-22T06:02:47.852+0000,STOREFARM,5,DIY 디즈니 캐릭터 보석십자수 액자형 프린세스 알라딘 밤비 앨리스 아이러브페인팅,제품 선택: 09.토이스토리4 투게더 보석십자수
3119364814,SELLBLOG,NORMAL,아이가졸라서 사줫는데 그림이 이뿌긴하네요. 부디 이번엔 완성하길.,2021-02-24T01:55:31.993+0000,STOREFARM,5,DIY 디즈니 캐릭터 보석십자수 액자형 프린세스 알라딘 밤비 앨리스 아이러브페인팅,제품 선택: 18. 알라딘 커플 보석십자수
3114893166,SELLBLOG,NORMAL,"재밌어요^^
쬐끔씩 불량있는걸 무시하고 붙였다가 자꾸 눈에 걸리적거려서 다시 떼게되네요;;
첨부터 양품으로 이쁘게 붙이세요ㅋ",2021-02-18T05:09:19.521+0000,STOREFARM,5,DIY 디즈니 캐릭터 보석십자수 액자형 프린세스 알라딘 밤비 앨리스 아이러브페인팅,제품 선택: 13. 노을과 에리얼 보석십자수
3141919989,SELLBLOG,NORMAL,재입고 기다린 보람이 있어요,2021-03-27T16:56:51.910+0000,STOREFARM,4,DIY 디즈니 캐릭터 보석십자수 액자형 프린세스 알라딘 밤비 앨리스 아이러브페인팅,제품 선택: 17. 달밤 자스민 알라딘 보석십자수
3127081054,SELLBLOG,NORMAL,시간 가는 줄 모르고 하게 되네요.,2021-03-07T04:36:40.746+0000,STOREFARM,4,DIY 디즈니 캐릭터 보석십자수 액자형 프린세스 알라딘 밤비 앨리스 아이러브페인팅,제품 선택: 14. 인어공주 커플 보석십자수
3126240279,SELLBLOG,NORMAL,견고하고 예뻤어요 완성하니 너무 예쁘네요,2021-03-06T02:31:43.416+0000,STOREFARM,5,DIY 디즈니 캐릭터 보석십자수 액자형 프린세스 알라딘 밤비 앨리스 아이러브페인팅,제품 선택: 21. 숲속 앨리스 보석십자수
3139479448,SELLBLOG,AFTER_USE,완성하는데는 꽤나 오랜 시간이 걸릴듯 합니다.,2021-03-24T09:38:06.009+0000,STOREFARM,5,DIY 디즈니 캐릭터 보석십자수 액자형 프린세스 알라딘 밤비 앨리스 아이러브페인팅,제품 선택: 19. 자스민 알라딘 보석십자수
3125323347,SELLBLOG,NORMAL,사이즈가 커서 힘들긴 하지만 너무 예뻐요,2021-03-04T16:50:53.076+0000,STOREFARM,4,DIY 디즈니 캐릭터 보석십자수 액자형 프린세스 알라딘 밤비 앨리스 아이러브페인팅,제품 선택: 21. 숲속 앨리스 보석십자수
3122403121,SELLBLOG,AFTER_USE,"예뻐용~~~~킬링타임용~^^

알라딘은 아직 열시미 하는중~~",2021-02-28T05:57:46.917+0000,STOREFARM,5,DIY 디즈니 캐릭터 보석십자수 액자형 프린세스 알라딘 밤비 앨리스 아이러브페인팅,제품 선택: 18. 알라딘 커플 보석십자수
3158512649,SELLBLOG,NORMAL,조아요조아요조아요조아요,2021-04-21T00:12:25.095+0000,STOREFARM,5,DIY 디즈니 캐릭터 보석십자수 액자형 프린세스 알라딘 밤비 앨리스 아이러브페인팅,제품 선택: 09.토이스토리4 투게더 보석십자수
3139882887,SELLBLOG,AFTER_USE,비즈 여유 분량이 아주 많아서 좋았습니다,2021-03-25T00:49:50.437+0000,STOREFARM,5,DIY 디즈니 캐릭터 보석십자수 액자형 프린세스 알라딘 밤비 앨리스 아이러브페인팅,제품 선택: 14. 인어공주 커플 보석십자수
3115181258,SELLBLOG,NORMAL,"딸래미가 집중모드로 오자마자 완성해 가고 있습니다.
사이즈가 커서 시간이 좀 걸리겠내요~~
휴대폰만 보는것 보다.. 좋을듯",2021-02-18T10:51:46.608+0000,STOREFARM,5,DIY 디즈니 캐릭터 보석십자수 액자형 프린세스 알라딘 밤비 앨리스 아이러브페인팅,제품 선택: 13. 노을과 에리얼 보석십자수
3136305135,SELLBLOG,NORMAL,미키도 구매 하고 싶은데요. 품절상태 라서 구매가 어렵네요.,2021-03-19T15:40:35.894+0000,STOREFARM,5,DIY 디즈니 캐릭터 보석십자수 액자형 프린세스 알라딘 밤비 앨리스 아이러브페인팅,제품 선택: 24. 헬로 미니 보석십자수
3141010945,SELLBLOG,AFTER_USE,색감도 좋고 시간때우기 좋아요,2021-03-26T09:07:29.279+0000,STOREFARM,5,DIY 디즈니 캐릭터 보석십자수 액자형 프린세스 알라딘 밤비 앨리스 아이러브페인팅,제품 선택: 08.토이스토리4 노을 보석십자수
3128653308,SELLBLOG,NORMAL,배송이 빠른 점이 좋아요,2021-03-09T09:51:51.865+0000,STOREFARM,5,DIY 디즈니 캐릭터 보석십자수 액자형 프린세스 알라딘 밤비 앨리스 아이러브페인팅,제품 선택: 04.토이스토리4 포키 보석십자수
3138318227,SELLBLOG,NORMAL,맘에들어요 열심히 하고있어요,2021-03-23T01:21:40.527+0000,STOREFARM,5,DIY 디즈니 캐릭터 보석십자수 액자형 프린세스 알라딘 밤비 앨리스 아이러브페인팅,제품 선택: 13. 노을과 에리얼 보석십자수
3115428150,SELLBLOG,NORMAL,시간도 가는 줄 모르고 열심히 붙였습니다 목은 아팠지만 결과물이 너무 마음에 들어요 거실에 전시 중입니다,2021-02-18T15:52:02.174+0000,STOREFARM,5,DIY 디즈니 캐릭터 보석십자수 액자형 프린세스 알라딘 밤비 앨리스 아이러브페인팅,제품 선택: 13. 노을과 에리얼 보석십자수
3141847105,SELLBLOG,NORMAL,크고 예뻐용 맘에 들어요,2021-03-27T13:46:32.806+0000,STOREFARM,5,DIY 디즈니 캐릭터 보석십자수 액자형 프린세스 알라딘 밤비 앨리스 아이러브페인팅,제품 선택: 21. 숲속 앨리스 보석십자수
3105429864,SELLBLOG,AFTER_USE,"생각없이 붙이다보면 시간 진짜 잘가요ㅋㅋ
보석이 블링블링하게 빛나서 완성하면 더욱 예쁠 것 같아요! 다른 것들보다 색이 연한 게 많고 파스텔톤이라서 완성했을 때 임팩트가 좀 약하지
않을까 싶었는데.. 전혀 그렇지 않고 오히려 은은하니 예쁘네요
보석 퀄리티도 괜찮고 펜도 종류별로 많이 주고 풀도 양이 많아여 캔버스질도 좋은 것 같아요",2021-02-02T14:09:39.521+0000,STOREFARM,5,DIY 디즈니 캐릭터 보석십자수 액자형 프린세스 알라딘 밤비 앨리스 아이러브페인팅,제품 선택: 35. 푸우의 하루 보석십자수
3117796805,SELLBLOG,NORMAL,"시간가는 줄 모르고 하고 있습니당
도안도 퀄리티 너무 좋아용 ! 빨리 완성하고싶어오",2021-02-22T00:56:45.078+0000,STOREFARM,5,DIY 디즈니 캐릭터 보석십자수 액자형 프린세스 알라딘 밤비 앨리스 아이러브페인팅,제품 선택: 09.토이스토리4 투게더 보석십자수
3142600071,SELLBLOG,NORMAL,"좋아요
이쁘네요
아이가 좋아해요",2021-03-29T01:28:18.002+0000,STOREFARM,4,DIY 디즈니 캐릭터 보석십자수 액자형 프린세스 알라딘 밤비 앨리스 아이러브페인팅,제품 선택: 04.토이스토리4 포키 보석십자수
3121117620,SELLBLOG,NORMAL,집콕생활에 알맞은 취미만들기로 굳!,2021-02-26T05:36:02.381+0000,STOREFARM,5,DIY 디즈니 캐릭터 보석십자수 액자형 프린세스 알라딘 밤비 앨리스 아이러브페인팅,
3143397243,SELLBLOG,AFTER_USE,시간이 후딱지나갑니니ㅣ,2021-03-30T06:07:52.153+0000,STOREFARM,5,DIY 디즈니 캐릭터 보석십자수 액자형 프린세스 알라딘 밤비 앨리스 아이러브페인팅,제품 선택: 20. 꽃 밤비 보석십자수
3123881037,SELLBLOG,NORMAL,애들이너무좋아함 성취감들고 그림도 이쁨,2021-03-03T02:17:21.102+0000,STOREFARM,5,DIY 디즈니 캐릭터 보석십자수 액자형 프린세스 알라딘 밤비 앨리스 아이러브페인팅,제품 선택: 09.토이스토리4 투게더 보석십자수
3125430760,SELLBLOG,NORMAL,색깔이 다양해서 예쁠 것 같습니다,2021-03-05T00:52:23.247+0000,STOREFARM,5,DIY 디즈니 캐릭터 보석십자수 액자형 프린세스 알라딘 밤비 앨리스 아이러브페인팅,제품 선택: 09.토이스토리4 투게더 보석십자수
3112301755,SELLBLOG,NORMAL,포장도 깔끔하게 잘 되어있고 너무 재밌어서 시간가는줄 모르고 하고있습니다!! 너무 재밌어요~!!,2021-02-14T12:27:45.178+0000,STOREFARM,5,DIY 디즈니 캐릭터 보석십자수 액자형 프린세스 알라딘 밤비 앨리스 아이러브페인팅,제품 선택: 22. 디즈니 캐슬 보석십자수
3114480571,SELLBLOG,NORMAL,"이제 막 하기 시작했어요~ 
에리얼 너무 예쁘고 생각보다 더 크네욜,,
이게 벌써 세번째 보석십자수 작품인데 잘 완성해 볼게요 !!",2021-02-17T14:08:25.794+0000,STOREFARM,5,DIY 디즈니 캐릭터 보석십자수 액자형 프린세스 알라딘 밤비 앨리스 아이러브페인팅,제품 선택: 13. 노을과 에리얼 보석십자수
3111945498,SELLBLOG,NORMAL,"색감도 이쁘고 이쁘네요~
같은 곳에서 주문 했는데 디즈니 라인이랑 일반이랑 다른가 봐요.. 보석비즈가 더 좋으네요
물론 일부는.. 두개씩 붙어서 무조건 떼어서 써야 해요",2021-02-13T09:52:12.974+0000,STOREFARM,4,DIY 디즈니 캐릭터 보석십자수 액자형 프린세스 알라딘 밤비 앨리스 아이러브페인팅,제품 선택: 20. 꽃 밤비 보석십자수
3140508375,SELLBLOG,NORMAL,"포장깔끔하고,배송빠르고
좋았어요",2021-03-25T15:58:00.957+0000,STOREFARM,5,DIY 디즈니 캐릭터 보석십자수 액자형 프린세스 알라딘 밤비 앨리스 아이러브페인팅,제품 선택: 22. 디즈니 캐슬 보석십자수
3127199631,SELLBLOG,NORMAL,보석십자수 재밌어요,2021-03-07T08:14:38.181+0000,STOREFARM,5,DIY 디즈니 캐릭터 보석십자수 액자형 프린세스 알라딘 밤비 앨리스 아이러브페인팅,제품 선택: 21. 숲속 앨리스 보석십자수
3111061182,SELLBLOG,AFTER_USE,방학하고 시간이 많아지면서 그동안 꼭 해보고싶어서 시작했어요 근데 진짜 너무 재밌고 사길 잘했다 싶네요 뿌듯하고 이쁘고 아직 쪼금 남았지만 금방 완성하고 다른거 하나 더 살거에요,2021-02-10T14:36:25.620+0000,STOREFARM,5,DIY 디즈니 캐릭터 보석십자수 액자형 프린세스 알라딘 밤비 앨리스 아이러브페인팅,제품 선택: 18. 알라딘 커플 보석십자수
3127281646,SELLBLOG,AFTER_USE,"집콕하는 요즘 새로운 취미로 시작했는데 너무 재밌었어요 하는동안 시간 가는줄도 모르곸ㅋㅋㅋ
퀄리티도 좋고 다 완성하고 방 이쁘게 꾸며봤어요~",2021-03-07T10:54:43.002+0000,STOREFARM,5,DIY 디즈니 캐릭터 보석십자수 액자형 프린세스 알라딘 밤비 앨리스 아이러브페인팅,제품 선택: 12. 드림 빅 프린세스 에리얼 보석십자수
3122824479,SELLBLOG,NORMAL,재밌어요 시간순삿이에요,2021-03-01T02:41:05.583+0000,STOREFARM,5,DIY 디즈니 캐릭터 보석십자수 액자형 프린세스 알라딘 밤비 앨리스 아이러브페인팅,제품 선택: 04.토이스토리4 포키 보석십자수
3132101418,SELLBLOG,AFTER_USE,한달이 지나도 아직 완성 못했어료.. ....ㅋㅋㅋ 제품은 좋지만 거북목을 얻었네여 제품은 문제없이 예뻐요,2021-03-14T01:04:50.316+0000,STOREFARM,5,DIY 디즈니 캐릭터 보석십자수 액자형 프린세스 알라딘 밤비 앨리스 아이러브페인팅,제품 선택: 17. 달밤 자스민 알라딘 보석십자수
3111203884,SELLBLOG,AFTER_USE,방학동안 뭐하나 생각했는데 주변 친구들이 보석십자수를 추천해줘서 사봤어요!! 시간이 금방가기도하고 재밌네요!! 고체풀도 넉넉하게 주시고 도구도 여러가지 주셔서 잘 사용 중 입니다,2021-02-11T03:02:00.915+0000,STOREFARM,5,DIY 디즈니 캐릭터 보석십자수 액자형 프린세스 알라딘 밤비 앨리스 아이러브페인팅,제품 선택: 09.토이스토리4 투게더 보석십자수
3118512193,SELLBLOG,NORMAL,"밤비 밤비 너무 예뻐요~
아직 완성은 덜됐지만 취미로 즐겁게 하고 있습니다~~",2021-02-23T01:28:25.457+0000,STOREFARM,5,DIY 디즈니 캐릭터 보석십자수 액자형 프린세스 알라딘 밤비 앨리스 아이러브페인팅,제품 선택: 20. 꽃 밤비 보석십자수
3119672370,SELLBLOG,NORMAL,딸아이가 하고싶어해서 사줫는데 아주 좋아하고 하는동안 게임이나 폰안봐서 좋아요,2021-02-24T08:58:40.618+0000,STOREFARM,5,DIY 디즈니 캐릭터 보석십자수 액자형 프린세스 알라딘 밤비 앨리스 아이러브페인팅,제품 선택: 18. 알라딘 커플 보석십자수
