id,reviewServiceType,reviewType,reviewContent,createDate,channelServiceType,reviewScore,productName,productOptionContent
3081817677,SELLBLOG,NORMAL,"집콕하면서 하려고 주문했어요
생각보다 커서 놀랐지만
열심히 하고 있습니당
성취감 대박이에요",2021-01-02T14:28:41.293+0000,STOREFARM,5,DIY 디즈니 캐릭터 보석십자수 액자형 프린세스 알라딘 밤비 앨리스 아이러브페인팅,제품 선택: 17. 달밤 자스민 알라딘 보석십자수
3098621296,SELLBLOG,NORMAL,반짝반짝이뻐용 생각보다커서놀랬어요ㅋㅋ,2021-01-24T02:14:46.395+0000,STOREFARM,5,DIY 디즈니 캐릭터 보석십자수 액자형 프린세스 알라딘 밤비 앨리스 아이러브페인팅,제품 선택: 13. 노을과 에리얼 보석십자수
3093443681,SELLBLOG,NORMAL,3명이 함께 할 수 있는 구성이에요~설명이 조금더 자세히 나오면 좋겠는데 구성은 좋아요~,2021-01-17T07:22:27.265+0000,STOREFARM,5,DIY 디즈니 캐릭터 보석십자수 액자형 프린세스 알라딘 밤비 앨리스 아이러브페인팅,제품 선택: 13. 노을과 에리얼 보석십자수
3105505609,SELLBLOG,NORMAL,벌써 두개째 구매예요 아이가 집중력도 좋아진다고 만족합니다.,2021-02-02T16:43:43.597+0000,STOREFARM,5,DIY 디즈니 캐릭터 보석십자수 액자형 프린세스 알라딘 밤비 앨리스 아이러브페인팅,제품 선택: 13. 노을과 에리얼 보석십자수
3098002706,SELLBLOG,NORMAL,심심할때하면 정말 재미있습니다,2021-01-23T04:07:41.833+0000,STOREFARM,4,DIY 디즈니 캐릭터 보석십자수 액자형 프린세스 알라딘 밤비 앨리스 아이러브페인팅,제품 선택: 14. 인어공주 커플 보석십자수
3090782087,SELLBLOG,NORMAL,너무 예뻐요 생각하던 그대로입니다 ㅠ 배송도 2일만에 왔어여,2021-01-14T03:34:38.307+0000,STOREFARM,5,DIY 디즈니 캐릭터 보석십자수 액자형 프린세스 알라딘 밤비 앨리스 아이러브페인팅,제품 선택: 09.토이스토리4 투게더 보석십자수
3098223088,SELLBLOG,NORMAL,"집코놀이로 좋을것 같아요
완성되면 예쁠것 같아요",2021-01-23T08:43:22.991+0000,STOREFARM,5,DIY 디즈니 캐릭터 보석십자수 액자형 프린세스 알라딘 밤비 앨리스 아이러브페인팅,제품 선택: 22. 디즈니 캐슬 보석십자수
3131308949,SELLBLOG,NORMAL,좋습니다!!!!!!,2021-03-12T15:05:59.608+0000,STOREFARM,5,DIY 디즈니 캐릭터 보석십자수 액자형 프린세스 알라딘 밤비 앨리스 아이러브페인팅,제품 선택: 09.토이스토리4 투게더 보석십자수
3112794345,SELLBLOG,NORMAL,완성하고나니이뻐요.,2021-02-15T12:38:36.077+0000,STOREFARM,5,DIY 디즈니 캐릭터 보석십자수 액자형 프린세스 알라딘 밤비 앨리스 아이러브페인팅,제품 선택: 20. 꽃 밤비 보석십자수
3087266647,SELLBLOG,NORMAL,타사 제품 할인할 때 사서 쓰고 있는데 솔직히 퀄은 이쪽이 더 좋아요ㅠㅠ 담엔 그냥 여기서 사려구요,2021-01-09T13:29:53.061+0000,STOREFARM,5,DIY 디즈니 캐릭터 보석십자수 액자형 프린세스 알라딘 밤비 앨리스 아이러브페인팅,제품 선택: 22. 디즈니 캐슬 보석십자수
3110423931,SELLBLOG,NORMAL,너무 이뻐용 이거 다하고 알라딘이랑 미키마우스도 사려구용~~,2021-02-09T11:17:59.246+0000,STOREFARM,5,DIY 디즈니 캐릭터 보석십자수 액자형 프린세스 알라딘 밤비 앨리스 아이러브페인팅,제품 선택: 22. 디즈니 캐슬 보석십자수
3111168446,SELLBLOG,NORMAL,두번째 구매인데 이번에도 넘 예쁘네용,2021-02-11T01:37:10.067+0000,STOREFARM,5,DIY 디즈니 캐릭터 보석십자수 액자형 프린세스 알라딘 밤비 앨리스 아이러브페인팅,제품 선택: 22. 디즈니 캐슬 보석십자수
3093171657,SELLBLOG,NORMAL,넘이뻐요 끝내고 다른것하고싶엉르,2021-01-17T00:57:35.439+0000,STOREFARM,5,DIY 디즈니 캐릭터 보석십자수 액자형 프린세스 알라딘 밤비 앨리스 아이러브페인팅,제품 선택: 19. 자스민 알라딘 보석십자수
3093117014,SELLBLOG,NORMAL,생각보다 크고 비즈랑 그림 너무 만족합니다 시간될때 바로 해볼께요,2021-01-16T19:17:35.251+0000,STOREFARM,5,DIY 디즈니 캐릭터 보석십자수 액자형 프린세스 알라딘 밤비 앨리스 아이러브페인팅,제품 선택: 21. 숲속 앨리스 보석십자수
3083017553,SELLBLOG,NORMAL,"배송이 일주일걸려서 왔네요 그래도 온게 다행이죠뭐.
근데 비즈 두세개씩 붙어있는게 많아서 할때마다 떼어내고 시작해야되서 불편합니다ㅜ",2021-01-04T13:12:47.888+0000,STOREFARM,4,DIY 디즈니 캐릭터 보석십자수 액자형 프린세스 알라딘 밤비 앨리스 아이러브페인팅,제품 선택: 15. 숲속 백설공주 보석십자수
3111824771,SELLBLOG,NORMAL,너무 깔끔하게 배송이 왔어요,2021-02-13T02:12:13.079+0000,STOREFARM,5,DIY 디즈니 캐릭터 보석십자수 액자형 프린세스 알라딘 밤비 앨리스 아이러브페인팅,제품 선택: 17. 달밤 자스민 알라딘 보석십자수
3090732039,SELLBLOG,NORMAL,딸이 명화그리기 2번하고 이번엔 명화십자수 도전 중인데 조금 했는데도 너무 예쁘다고 만족해합니다,2021-01-14T02:32:49.592+0000,STOREFARM,5,DIY 디즈니 캐릭터 보석십자수 액자형 프린세스 알라딘 밤비 앨리스 아이러브페인팅,제품 선택: 12. 드림 빅 프린세스 에리얼 보석십자수
3108478225,SELLBLOG,NORMAL,"포장도 잘 되어 있어서 좋아요
선물하려고 했는데 박스 포장이 잘 되어있어거 만족이에요",2021-02-06T12:19:29.355+0000,STOREFARM,5,DIY 디즈니 캐릭터 보석십자수 액자형 프린세스 알라딘 밤비 앨리스 아이러브페인팅,제품 선택: 17. 달밤 자스민 알라딘 보석십자수
3095612483,SELLBLOG,NORMAL,알라딘처돌이인 친구한테 선물했는데 넘나 좋아하네요ㅎㅎㅎ!!,2021-01-20T05:04:10.663+0000,STOREFARM,5,DIY 디즈니 캐릭터 보석십자수 액자형 프린세스 알라딘 밤비 앨리스 아이러브페인팅,제품 선택: 17. 달밤 자스민 알라딘 보석십자수
3104928093,SELLBLOG,NORMAL,시간 정말 후딱가구  제가 디즈니 진짜 좋아하는데 퀄리도 좋네요 ㅠ  쵝오!!!,2021-02-02T03:53:31.180+0000,STOREFARM,5,DIY 디즈니 캐릭터 보석십자수 액자형 프린세스 알라딘 밤비 앨리스 아이러브페인팅,제품 선택: 18. 알라딘 커플 보석십자수
3087949860,SELLBLOG,NORMAL,배송 늦을줄알았는데 생각보다 빨리왔어요! 완전 집중해서 햇더니 금방 완성해서 좋아여!,2021-01-10T13:59:09.653+0000,STOREFARM,5,DIY 디즈니 캐릭터 보석십자수 액자형 프린세스 알라딘 밤비 앨리스 아이러브페인팅,제품 선택: 17. 달밤 자스민 알라딘 보석십자수
3081772452,SELLBLOG,NORMAL,"보석십자수를 좋아해서 전에 했던 크기보다 조금더 큰걸로 주문했는데 크기 색깔 다 마음에 듭니다
제품이 도착하자마자 앉아서 열심히 하네요~
좋은제품 보내주셔서 감사합니다 ~^^",2021-01-02T13:13:27.484+0000,STOREFARM,5,DIY 디즈니 캐릭터 보석십자수 액자형 프린세스 알라딘 밤비 앨리스 아이러브페인팅,제품 선택: 29. 귀여운 푸 보석십자수
3076699670,SELLBLOG,NORMAL,기대한만큼 엄청 예뻐요! 도구도 알차게 챙겨주셔서 감사해요 다른 곳에선 추가상품으로 팔길래 기본만 주실 줄 알았는데 아니더라구요 사용하기 매우 좋습니당,2020-12-26T13:01:24.038+0000,STOREFARM,5,DIY 디즈니 캐릭터 보석십자수 액자형 프린세스 알라딘 밤비 앨리스 아이러브페인팅,제품 선택: 14. 인어공주 커플 보석십자수
3095925430,SELLBLOG,NORMAL,아이가 하기에는 난이도가 있지만 재미나 보이네요,2021-01-20T11:08:37.607+0000,STOREFARM,5,DIY 디즈니 캐릭터 보석십자수 액자형 프린세스 알라딘 밤비 앨리스 아이러브페인팅,제품 선택: 22. 디즈니 캐슬 보석십자수
3109940636,SELLBLOG,AFTER_USE,예쁜데 접착력이 안 좋은건지 큐빅 몇개가 떨어져요ㅠㅠ,2021-02-08T21:36:50.628+0000,STOREFARM,5,DIY 디즈니 캐릭터 보석십자수 액자형 프린세스 알라딘 밤비 앨리스 아이러브페인팅,제품 선택: 17. 달밤 자스민 알라딘 보석십자수
3082367551,SELLBLOG,NORMAL,실물로봐야 더 반짝거리고 예뻐요!!!!! 4일정도 걸린것같아요 목이너무아픈데 넘 뿌듯해여,2021-01-03T12:37:46.344+0000,STOREFARM,5,DIY 디즈니 캐릭터 보석십자수 액자형 프린세스 알라딘 밤비 앨리스 아이러브페인팅,제품 선택: 22. 디즈니 캐슬 보석십자수
3111878999,SELLBLOG,NORMAL,배송도 빠르고 재미있어요,2021-02-13T05:29:35.595+0000,STOREFARM,5,DIY 디즈니 캐릭터 보석십자수 액자형 프린세스 알라딘 밤비 앨리스 아이러브페인팅,제품 선택: 09.토이스토리4 투게더 보석십자수
3081514521,SELLBLOG,NORMAL,"나무틀로 와서 보관하기 더 편할 것 같아요
비즈는 불량비즈들이 꽤 있었지만
비즈는 많이 넣어주셔서 많이 남았어요
고체풀도 펜이랑 판도 많이 주셔서 아낌없이 썼습니다
또 해보고 싶네용",2021-01-02T06:51:51.085+0000,STOREFARM,5,DIY 디즈니 캐릭터 보석십자수 액자형 프린세스 알라딘 밤비 앨리스 아이러브페인팅,제품 선택: 22. 디즈니 캐슬 보석십자수
3074283562,SELLBLOG,NORMAL,하면 할수록 예뻐서 매일 하고 있습니당 본드냄새가 좀 난다는 후기가 있어서 걱정했는데 저한테는 신경쓰일 정도는 아니고 불량이 좀 있지만 여분도 넉넉하게 있어서 문제 없을 거 같아요! 얼른 하고 다른 그림으로 또 사려구요,2020-12-23T10:24:22.844+0000,STOREFARM,5,DIY 디즈니 캐릭터 보석십자수 액자형 프린세스 알라딘 밤비 앨리스 아이러브페인팅,제품 선택: 17. 달밤 자스민 알라딘 보석십자수
3098927494,SELLBLOG,NORMAL,도안이  정말 예쁘답니다,2021-01-24T11:31:00.389+0000,STOREFARM,5,DIY 디즈니 캐릭터 보석십자수 액자형 프린세스 알라딘 밤비 앨리스 아이러브페인팅,제품 선택: 20. 꽃 밤비 보석십자수
3111525644,SELLBLOG,NORMAL,"너무예쁘네요
아이가좋와합니다",2021-02-12T03:35:48.094+0000,STOREFARM,5,DIY 디즈니 캐릭터 보석십자수 액자형 프린세스 알라딘 밤비 앨리스 아이러브페인팅,제품 선택: 13. 노을과 에리얼 보석십자수
3080699834,SELLBLOG,NORMAL,"페인팅과는 다른 느낌이 들어서 좋아요.
근데 실제 그림의 색과 비즈색이 좀 많이 차이나네요. 특히 알라딘의 달부분이 비즈가 더 누렇고 진한느낌입니다.
하다보면 비즈가 방안에 굴러다녀서 신경쓰이는 것도 있어요",2021-01-01T03:37:49.463+0000,STOREFARM,4,DIY 디즈니 캐릭터 보석십자수 액자형 프린세스 알라딘 밤비 앨리스 아이러브페인팅,제품 선택: 17. 달밤 자스민 알라딘 보석십자수
3091904511,SELLBLOG,NORMAL,"하다보니 시간가는 줄 모르겠어요~
뿌듯함도 있고 재밌네요 ㅎㅎ",2021-01-15T07:25:57.465+0000,STOREFARM,5,DIY 디즈니 캐릭터 보석십자수 액자형 프린세스 알라딘 밤비 앨리스 아이러브페인팅,제품 선택: 21. 숲속 앨리스 보석십자수
3104111175,SELLBLOG,NORMAL,영화 보면서 멍 때리며 하다보니 빨리 끝났네요 너무 예뻐서 다 하고 감탄했어요,2021-01-31T17:29:43.322+0000,STOREFARM,5,DIY 디즈니 캐릭터 보석십자수 액자형 프린세스 알라딘 밤비 앨리스 아이러브페인팅,제품 선택: 18. 알라딘 커플 보석십자수
3081021581,SELLBLOG,NORMAL,"위에 보호비닐 덮여있는 상태로 촬영했어요~
실물로보는게 진짜 반짝거리고 이뻐용
재밌게하고있습니당~",2021-01-01T11:29:23.540+0000,STOREFARM,5,DIY 디즈니 캐릭터 보석십자수 액자형 프린세스 알라딘 밤비 앨리스 아이러브페인팅,제품 선택: 22. 디즈니 캐슬 보석십자수
3098400478,SELLBLOG,NORMAL,생각보다 이뻐요 시간순삭,2021-01-23T13:08:32.159+0000,STOREFARM,5,DIY 디즈니 캐릭터 보석십자수 액자형 프린세스 알라딘 밤비 앨리스 아이러브페인팅,제품 선택: 15. 숲속 백설공주 보석십자수
3100319801,SELLBLOG,NORMAL,제가 보석십자수를 하면 많이 질려하는 편인데 이건디자인도 이쁘고 왠지모르게 안질리네요. 항상 잘하고 있습니다.,2021-01-26T11:43:50.438+0000,STOREFARM,5,DIY 디즈니 캐릭터 보석십자수 액자형 프린세스 알라딘 밤비 앨리스 아이러브페인팅,제품 선택: 03.토이스토리4 외계인 보석십자수
3092745701,SELLBLOG,NORMAL,칸이 조금 작은듯 하지만 깔끔하게 잘 포장되어 왔네요 얼른 완성시키고 싶어요!!,2021-01-16T07:59:28.306+0000,STOREFARM,5,DIY 디즈니 캐릭터 보석십자수 액자형 프린세스 알라딘 밤비 앨리스 아이러브페인팅,제품 선택: 13. 노을과 에리얼 보석십자수
3096234829,SELLBLOG,NORMAL,보석십자수 처음 사보는데 아주 만족합니다!!,2021-01-20T23:36:22.980+0000,STOREFARM,5,DIY 디즈니 캐릭터 보석십자수 액자형 프린세스 알라딘 밤비 앨리스 아이러브페인팅,제품 선택: 09.토이스토리4 투게더 보석십자수
3105057353,SELLBLOG,NORMAL,넘 좋아요 크기가 생각보다 커서 언제 끝낼진 모르겟지만 너무 예뻐요ㅋㅋ,2021-02-02T06:57:41.671+0000,STOREFARM,5,DIY 디즈니 캐릭터 보석십자수 액자형 프린세스 알라딘 밤비 앨리스 아이러브페인팅,제품 선택: 17. 달밤 자스민 알라딘 보석십자수
3099266461,SELLBLOG,NORMAL,아이가 너무 재밌어하네요~~^^,2021-01-25T03:06:25.351+0000,STOREFARM,5,DIY 디즈니 캐릭터 보석십자수 액자형 프린세스 알라딘 밤비 앨리스 아이러브페인팅,제품 선택: 33. 푸우와 나비 보석십자수
3099265901,SELLBLOG,NORMAL,아이가 너무 재밌어하네요~~^^,2021-01-25T03:05:37.975+0000,STOREFARM,5,DIY 디즈니 캐릭터 보석십자수 액자형 프린세스 알라딘 밤비 앨리스 아이러브페인팅,제품 선택: 25. 조각보 미키 보석십자수
3083211161,SELLBLOG,NORMAL,오~ 생각보다 크네요ㅎ 방학이라 아이놀이감으로샀는데 제가더 재밌네요? 집중하기딱좋아요 색감도예쁘고 다해버릴까봐 아쉽네요ㅋㅋ,2021-01-05T01:45:57.744+0000,STOREFARM,5,DIY 디즈니 캐릭터 보석십자수 액자형 프린세스 알라딘 밤비 앨리스 아이러브페인팅,제품 선택: 13. 노을과 에리얼 보석십자수
3102561702,SELLBLOG,NORMAL,일단 너무 예쁘네용!! 준비물을 아낌없이 주셔서 처음인데도 불구하고 편하게 즐길 수 있었습니다^^!,2021-01-29T08:38:15.243+0000,STOREFARM,5,DIY 디즈니 캐릭터 보석십자수 액자형 프린세스 알라딘 밤비 앨리스 아이러브페인팅,
3098848871,SELLBLOG,AFTER_USE,집콕 하시는 분들 강추,2021-01-24T09:01:16.770+0000,STOREFARM,5,DIY 디즈니 캐릭터 보석십자수 액자형 프린세스 알라딘 밤비 앨리스 아이러브페인팅,제품 선택: 09.토이스토리4 투게더 보석십자수
3105999806,SELLBLOG,NORMAL,알이 너무 작아요 아무리 잘맞춰도 줄간격도 안맞구요,2021-02-03T10:05:51.001+0000,STOREFARM,1,DIY 디즈니 캐릭터 보석십자수 액자형 프린세스 알라딘 밤비 앨리스 아이러브페인팅,제품 선택: 15. 숲속 백설공주 보석십자수
3097084180,SELLBLOG,NORMAL,너무 예쁘구 💜 하루만에 완성했어요,2021-01-22T00:47:20.271+0000,STOREFARM,5,DIY 디즈니 캐릭터 보석십자수 액자형 프린세스 알라딘 밤비 앨리스 아이러브페인팅,제품 선택: 25. 조각보 미키 보석십자수
3089622509,SELLBLOG,NORMAL,"집콕으로 무료한 생활을 알차게보낼수있어요
이거점점중독되네요ㅎㅎ",2021-01-12T15:58:34.996+0000,STOREFARM,5,DIY 디즈니 캐릭터 보석십자수 액자형 프린세스 알라딘 밤비 앨리스 아이러브페인팅,제품 선택: 15. 숲속 백설공주 보석십자수
3085593287,SELLBLOG,NORMAL,"코로나 때문에 어디나가지도 못해서
취미겸 해서 주문했었어요 포장도 꼼꼼하게오고
하는동안 시간도 너무잘가요",2021-01-07T13:19:11.964+0000,STOREFARM,5,DIY 디즈니 캐릭터 보석십자수 액자형 프린세스 알라딘 밤비 앨리스 아이러브페인팅,제품 선택: 12. 드림 빅 프린세스 에리얼 보석십자수
3094421598,SELLBLOG,NORMAL,진짜 너무 예뻐요ㅠㅠ또 살겁니다!,2021-01-18T14:03:03.016+0000,STOREFARM,5,DIY 디즈니 캐릭터 보석십자수 액자형 프린세스 알라딘 밤비 앨리스 아이러브페인팅,제품 선택: 13. 노을과 에리얼 보석십자수
3089855386,SELLBLOG,NORMAL,30분 비즈에 이물질들이 너무 많네요ㅠㅠ비즈 붙일때 같이 붙을거같아요..,2021-01-13T03:36:42.974+0000,STOREFARM,3,DIY 디즈니 캐릭터 보석십자수 액자형 프린세스 알라딘 밤비 앨리스 아이러브페인팅,제품 선택: 21. 숲속 앨리스 보석십자수
3106091492,SELLBLOG,NORMAL,동생꺼라 두개 샀어요~~둘다 정신없이 집중하게되네요,2021-02-03T11:43:08.584+0000,STOREFARM,5,DIY 디즈니 캐릭터 보석십자수 액자형 프린세스 알라딘 밤비 앨리스 아이러브페인팅,제품 선택: 14. 인어공주 커플 보석십자수
3092833451,SELLBLOG,NORMAL,빠른배송 최고에요 재구매했어요,2021-01-16T09:55:56.818+0000,STOREFARM,5,DIY 디즈니 캐릭터 보석십자수 액자형 프린세스 알라딘 밤비 앨리스 아이러브페인팅,제품 선택: 21. 숲속 앨리스 보석십자수
3109045739,SELLBLOG,NORMAL,"두번째예요
원하는게 품절이라 아쉽,
또 구매하러 오겠습니다.",2021-02-07T10:27:28.957+0000,STOREFARM,5,DIY 디즈니 캐릭터 보석십자수 액자형 프린세스 알라딘 밤비 앨리스 아이러브페인팅,제품 선택: 18. 알라딘 커플 보석십자수
3109310146,SELLBLOG,NORMAL,"배송은 많이 늦었습니다.
생각보다 판도크고 예쁘네요",2021-02-08T00:26:06.998+0000,STOREFARM,5,DIY 디즈니 캐릭터 보석십자수 액자형 프린세스 알라딘 밤비 앨리스 아이러브페인팅,제품 선택: 13. 노을과 에리얼 보석십자수
3109310060,SELLBLOG,NORMAL,"배송은 많이 늦었습니다.
생각보다 판도크고 예쁘네요",2021-02-08T00:25:58.629+0000,STOREFARM,5,DIY 디즈니 캐릭터 보석십자수 액자형 프린세스 알라딘 밤비 앨리스 아이러브페인팅,제품 선택: 19. 자스민 알라딘 보석십자수
3089621719,SELLBLOG,NORMAL,딱 적당한 크기에 귀여워요 다만 너무 단조로운거 같기도 해요,2021-01-12T15:56:32.440+0000,STOREFARM,4,DIY 디즈니 캐릭터 보석십자수 액자형 프린세스 알라딘 밤비 앨리스 아이러브페인팅,제품 선택: 04.토이스토리4 포키 보석십자수
3106497975,SELLBLOG,NORMAL,"배송이 빨라서 좋으네요.
시간 보내기 좋은 아이템!",2021-02-04T02:56:48.988+0000,STOREFARM,5,DIY 디즈니 캐릭터 보석십자수 액자형 프린세스 알라딘 밤비 앨리스 아이러브페인팅,제품 선택: 14. 인어공주 커플 보석십자수
3107655591,SELLBLOG,NORMAL,아이가 재미있어해요~ 초보자용으로 굳!!,2021-02-05T10:22:40.870+0000,STOREFARM,5,DIY 디즈니 캐릭터 보석십자수 액자형 프린세스 알라딘 밤비 앨리스 아이러브페인팅,제품 선택: 30. 귀여운 피글렛 보석십자수
3098163708,SELLBLOG,NORMAL,재미있게 잘하고 있어요,2021-01-23T07:23:25.428+0000,STOREFARM,5,DIY 디즈니 캐릭터 보석십자수 액자형 프린세스 알라딘 밤비 앨리스 아이러브페인팅,제품 선택: 13. 노을과 에리얼 보석십자수
3110829171,SELLBLOG,NORMAL,어깨랑 허리가 뻐근해지면 쉬는타임,2021-02-10T05:36:29.140+0000,STOREFARM,5,DIY 디즈니 캐릭터 보석십자수 액자형 프린세스 알라딘 밤비 앨리스 아이러브페인팅,제품 선택: 17. 달밤 자스민 알라딘 보석십자수
3108751926,SELLBLOG,NORMAL,우리아이가 사달라고 해서 주문했는데 아이가 넘 좋아하면 잘하고 있습니다^.^,2021-02-07T02:08:59.918+0000,STOREFARM,4,DIY 디즈니 캐릭터 보석십자수 액자형 프린세스 알라딘 밤비 앨리스 아이러브페인팅,제품 선택: 14. 인어공주 커플 보석십자수
3075911450,SELLBLOG,NORMAL,포장도 배송도 모두 잘 왔어요! 구성품도 빠진 것 없이 깔끔하게 와서 좋아요. 열심히해서 얼른 완성하고싶네요!,2020-12-25T11:01:48.832+0000,STOREFARM,5,DIY 디즈니 캐릭터 보석십자수 액자형 프린세스 알라딘 밤비 앨리스 아이러브페인팅,제품 선택: 18. 알라딘 커플 보석십자수
3075365756,SELLBLOG,NORMAL,"코로나때문에 집밖을 안나가는데 진짜 시간가는줄 모르고했어요 배송이 너무 늦긴한데 코로나때문이겠죠ㅠ
보석십자수 첫주문인데 하다보니 넘 커서ㅋㅋㅋ언젠간 다하겠죠? 재밌어요~~~",2020-12-24T14:30:13.172+0000,STOREFARM,5,DIY 디즈니 캐릭터 보석십자수 액자형 프린세스 알라딘 밤비 앨리스 아이러브페인팅,제품 선택: 18. 알라딘 커플 보석십자수
3096936184,SELLBLOG,NORMAL,조카선물로 사줬는데 좋아하네요ㅎ,2021-01-21T14:32:17.125+0000,STOREFARM,5,DIY 디즈니 캐릭터 보석십자수 액자형 프린세스 알라딘 밤비 앨리스 아이러브페인팅,제품 선택: 13. 노을과 에리얼 보석십자수
3109325247,SELLBLOG,NORMAL,잘받았ㅇ습니다 아이가 좋아하네요,2021-02-08T00:48:27.869+0000,STOREFARM,4,DIY 디즈니 캐릭터 보석십자수 액자형 프린세스 알라딘 밤비 앨리스 아이러브페인팅,제품 선택: 13. 노을과 에리얼 보석십자수
3083097805,SELLBLOG,NORMAL,"일단 집에서 할 일 없었는데 이거 하니까 너무 뿌듯해요
근데 배송이 몇일이나 걸린거죠😭😭😭
어쨌든 재구매 의사 있숩니당
열심히 할게용🧡",2021-01-04T16:03:27.159+0000,STOREFARM,4,DIY 디즈니 캐릭터 보석십자수 액자형 프린세스 알라딘 밤비 앨리스 아이러브페인팅,제품 선택: 18. 알라딘 커플 보석십자수
3097321917,SELLBLOG,NORMAL,완성하면 너무 이쁠거 같아요 ㅜ,2021-01-22T05:34:10.413+0000,STOREFARM,5,DIY 디즈니 캐릭터 보석십자수 액자형 프린세스 알라딘 밤비 앨리스 아이러브페인팅,제품 선택: 09.토이스토리4 투게더 보석십자수
3082281769,SELLBLOG,NORMAL,요즘같은 집순이템에는 완전 안성맞춤이에요!! 재료 하나하나 잘 들어있고 혼자놀기 딱 좋습니다~~하다보면 시간가는줄 모르게 하고 있어요ㅎㅎ,2021-01-03T10:18:02.431+0000,STOREFARM,5,DIY 디즈니 캐릭터 보석십자수 액자형 프린세스 알라딘 밤비 앨리스 아이러브페인팅,제품 선택: 17. 달밤 자스민 알라딘 보석십자수
3108823089,SELLBLOG,NORMAL,재미가있어요오오오우,2021-02-07T03:44:51.169+0000,STOREFARM,4,DIY 디즈니 캐릭터 보석십자수 액자형 프린세스 알라딘 밤비 앨리스 아이러브페인팅,제품 선택: 18. 알라딘 커플 보석십자수
3091409721,SELLBLOG,NORMAL,에리얼부터가 너무 이뻤고 오자마자 해보는중인데 쉽개 잘붙어서 좋아요,2021-01-14T15:34:45.277+0000,STOREFARM,5,DIY 디즈니 캐릭터 보석십자수 액자형 프린세스 알라딘 밤비 앨리스 아이러브페인팅,제품 선택: 12. 드림 빅 프린세스 에리얼 보석십자수
3085686489,SELLBLOG,NORMAL,잘왔어요ㅠ비즈쪼금씩 깨지고 얼룩인것들도있구 붙어있는게있어요 할때 문제는 없음,2021-01-07T15:39:02.086+0000,STOREFARM,5,DIY 디즈니 캐릭터 보석십자수 액자형 프린세스 알라딘 밤비 앨리스 아이러브페인팅,제품 선택: 18. 알라딘 커플 보석십자수
3087136657,SELLBLOG,NORMAL,"아이 방학이라 시간보내고 놀라고 주문했어요 
배송은 빠르진 않네요 상품은 잘왔습니다",2021-01-09T10:42:33.818+0000,STOREFARM,4,DIY 디즈니 캐릭터 보석십자수 액자형 프린세스 알라딘 밤비 앨리스 아이러브페인팅,제품 선택: 17. 달밤 자스민 알라딘 보석십자수
3087583414,SELLBLOG,NORMAL,집콕하면서 하기 딱좋아요 그림퀄리티도 좋고 디즈니라서 너무 만족스러워요 ~~,2021-01-10T04:11:18.738+0000,STOREFARM,5,DIY 디즈니 캐릭터 보석십자수 액자형 프린세스 알라딘 밤비 앨리스 아이러브페인팅,제품 선택: 08.토이스토리4 노을 보석십자수
3094724759,SELLBLOG,NORMAL,진짜 짱 재미있습니당!! 최고최고,2021-01-19T04:42:05.593+0000,STOREFARM,5,DIY 디즈니 캐릭터 보석십자수 액자형 프린세스 알라딘 밤비 앨리스 아이러브페인팅,제품 선택: 13. 노을과 에리얼 보석십자수
3088250771,SELLBLOG,NORMAL,토이스토리 광팬이라 안 살 수가 없었습니다 ㅠ 재밌게 잘 할게요 ㅎ,2021-01-11T03:53:15.230+0000,STOREFARM,5,DIY 디즈니 캐릭터 보석십자수 액자형 프린세스 알라딘 밤비 앨리스 아이러브페인팅,제품 선택: 09.토이스토리4 투게더 보석십자수
3098671434,SELLBLOG,AFTER_USE,알라딘만 완성했네요 예뻐요!!,2021-01-24T03:32:35.580+0000,STOREFARM,5,DIY 디즈니 캐릭터 보석십자수 액자형 프린세스 알라딘 밤비 앨리스 아이러브페인팅,제품 선택: 09.토이스토리4 투게더 보석십자수
